{
  "$schema": "./design.capabilities.schema.json",
  "schemaVersion": "1.0",
  "graphTypes": [
    "line",
    "bar"
  ],
  "metricSuggestions": [
    "amount_fiveks",
    "amount_hits",
    "amount_throws",
    "amount_wins",
    "avg_damage_dealt",
    "avg_damage_taken",
    "avg_distance",
    "avg_duration",
    "avg_score",
    "avg_score_correct_only",
    "damage_dealt",
    "damage_dealt_share",
    "damage_taken",
    "damage_taken_share",
    "fivek_rate",
    "games",
    "hit_rate",
    "rating",
    "rounds",
    "throw_rate",
    "win_rate"
  ],
  "graphContentDefinitions": {
    "time_patterns_weekday": {
      "title": "Weekday patterns",
      "metrics": [
        "games",
        "rounds",
        "avg_score",
        "avg_score_correct_only",
        "avg_distance",
        "avg_duration",
        "throw_rate",
        "amount_throws",
        "fivek_rate",
        "amount_fiveks",
        "hit_rate",
        "amount_hits",
        "win_rate",
        "amount_wins",
        "avg_damage_dealt",
        "damage_dealt",
        "avg_damage_taken",
        "damage_taken"
      ],
      "defaultMetric": "games",
      "sorts": [
        "chronological",
        "desc",
        "asc"
      ],
      "defaultSort": "chronological"
    },
    "time_patterns_hour": {
      "metrics": [
        "games",
        "rounds",
        "avg_score",
        "avg_score_correct_only",
        "avg_distance",
        "avg_duration",
        "throw_rate",
        "amount_throws",
        "fivek_rate",
        "amount_fiveks",
        "hit_rate",
        "amount_hits",
        "win_rate",
        "amount_wins",
        "avg_damage_dealt",
        "damage_dealt",
        "avg_damage_taken",
        "damage_taken"
      ],
      "defaultMetric": "games",
      "defaultSort": "chronological",
      "sorts": [
        "chronological",
        "desc",
        "asc"
      ]
    },
    "sessions": {
      "metrics": [
        "games",
        "rounds",
        "avg_score",
        "avg_score_correct_only",
        "avg_distance",
        "avg_duration",
        "throw_rate",
        "amount_throws",
        "fivek_rate",
        "amount_fiveks",
        "hit_rate",
        "amount_hits",
        "win_rate",
        "amount_wins",
        "avg_damage_dealt",
        "damage_dealt",
        "avg_damage_taken",
        "damage_taken"
      ],
      "defaultMetric": "avg_score",
      "defaultSort": "desc",
      "sorts": [
        "chronological",
        "desc",
        "asc"
      ]
    },
    "sessions_progression": {
      "metrics": [
        "games",
        "rounds",
        "avg_score",
        "avg_score_correct_only",
        "avg_distance",
        "avg_duration",
        "throw_rate",
        "amount_throws",
        "fivek_rate",
        "amount_fiveks",
        "hit_rate",
        "amount_hits",
        "win_rate",
        "amount_wins",
        "avg_damage_dealt",
        "damage_dealt",
        "avg_damage_taken",
        "damage_taken",
        "rating"
      ],
      "defaultMetric": "avg_score",
      "xDomain": "index",
      "maxPoints": 50
    },
    "tempo_buckets": {
      "metrics": [
        "rounds",
        "avg_score",
        "avg_score_correct_only",
        "avg_distance",
        "avg_duration",
        "throw_rate",
        "amount_throws",
        "fivek_rate",
        "amount_fiveks",
        "hit_rate",
        "amount_hits",
        "win_rate",
        "amount_wins",
        "avg_damage_dealt",
        "damage_dealt",
        "avg_damage_taken",
        "damage_taken"
      ],
      "defaultMetric": "avg_score",
      "defaultSort": "chronological",
      "sorts": [
        "chronological",
        "desc",
        "asc"
      ]
    },
    "score_distribution": {
      "defaultSort": "chronological",
      "sorts": [
        "chronological"
      ]
    },
    "rounds_progression": {
      "metrics": [
        "avg_score",
        "avg_score_correct_only",
        "avg_distance",
        "avg_duration",
        "throw_rate",
        "amount_throws",
        "fivek_rate",
        "amount_fiveks",
        "hit_rate",
        "amount_hits",
        "avg_damage_dealt",
        "damage_dealt",
        "avg_damage_taken",
        "damage_taken"
      ],
      "defaultMetric": "avg_score",
      "defaultSort": "chronological",
      "sorts": [
        "chronological"
      ]
    },
    "rounds_by_game_length": {
      "metrics": [
        "games",
        "avg_score",
        "avg_score_correct_only",
        "avg_distance",
        "avg_duration",
        "throw_rate",
        "amount_throws",
        "fivek_rate",
        "amount_fiveks",
        "hit_rate",
        "amount_hits",
        "win_rate",
        "amount_wins",
        "avg_damage_dealt",
        "damage_dealt",
        "avg_damage_taken",
        "damage_taken"
      ],
      "defaultMetric": "win_rate",
      "defaultSort": "chronological",
      "sorts": [
        "chronological",
        "desc",
        "asc"
      ]
    },
    "country_metrics": {
      "metrics": [
        "rounds",
        "avg_score",
        "avg_score_correct_only",
        "avg_distance",
        "avg_duration",
        "throw_rate",
        "amount_throws",
        "fivek_rate",
        "amount_fiveks",
        "hit_rate",
        "amount_hits",
        "win_rate",
        "amount_wins",
        "avg_damage_dealt",
        "damage_dealt",
        "damage_dealt_share",
        "avg_damage_taken",
        "damage_taken",
        "damage_taken_share"
      ],
      "defaultMetric": "avg_score",
      "defaultSort": "desc",
      "sorts": [
        "chronological",
        "desc",
        "asc"
      ]
    },
    "country_confusion_matrix": {
      "defaultSort": "desc",
      "sorts": [
        "desc",
        "asc"
      ]
    },
    "opponents_country": {
      "defaultSort": "desc",
      "sorts": [
        "desc",
        "asc"
      ]
    },
    "rating_history": {
      "metrics": [
        "rating"
      ],
      "defaultMetric": "rating",
      "defaultSort": "chronological",
      "sorts": [
        "chronological"
      ]
    },
    "spotlight_distribution": {
      "defaultSort": "chronological",
      "sorts": [
        "chronological"
      ]
    },
    "spotlight_trend": {
      "metrics": [
        "rounds",
        "avg_score",
        "avg_score_correct_only",
        "avg_distance",
        "avg_duration",
        "throw_rate",
        "amount_throws",
        "fivek_rate",
        "amount_fiveks",
        "hit_rate",
        "amount_hits",
        "win_rate",
        "amount_wins",
        "avg_damage_dealt",
        "damage_dealt",
        "damage_dealt_share",
        "avg_damage_taken",
        "damage_taken",
        "damage_taken_share"
      ],
      "defaultMetric": "avg_score",
      "compareMode": "period_to_date",
      "compareModeOptions": [
        "per_period",
        "to_date",
        "both"
      ],
      "defaultCompareMode": "to_date",
      "defaultSort": "chronological",
      "sorts": [
        "chronological"
      ]
    },
    "records_daily": {
      "defaultSort": "chronological",
      "sorts": [
        "chronological"
      ]
    },
    "overview_time_progression": {
      "metrics": [
        "games",
        "rounds",
        "avg_score",
        "avg_score_correct_only",
        "avg_distance",
        "avg_duration",
        "throw_rate",
        "amount_throws",
        "fivek_rate",
        "amount_fiveks",
        "hit_rate",
        "amount_hits",
        "win_rate",
        "amount_wins",
        "avg_damage_dealt",
        "damage_dealt",
        "avg_damage_taken",
        "damage_taken",
        "rating"
      ],
      "defaultMetric": "avg_score",
      "compareMode": "period_to_date",
      "compareModeOptions": [
        "per_period",
        "to_date",
        "both"
      ],
      "defaultCompareMode": "to_date",
      "defaultSort": "chronological",
      "sorts": [
        "chronological"
      ]
    }
  }
}
